### ISSUE TITLE
Connection timeouts since v4

### ISSUE THREAD

**Issue by madduck** [tb1337/paperless-api#426]
Hey,

I am using your lovely wrapper over at <https://github.com/madduck/pngx>, and it has stopped working. 3.1.15 produces an initialization error, and that's expected, but 4.0.0 and 4.1.0 regularly yield timeouts:

```
2025-05-29 09:34:16 root error Error while closing connector: ClientConnectionError('Connection lost: [SSL: APPLICATION_DATA_AFTER_CLOSE_NOTIFY] application data after close notify (_ssl.c:2776)') (connector.py:140)
Traceback (most recent call last):
  File "/home/madduck/.local/share/pipx/venvs/pngx/lib/python3.13/site-packages/aiohttp/connector.py", line 596, in connect
    proto = await self._create_connection(req, traces, timeout)
            ^^^^^^^^^^^^^^^^^^^^^^^^^^^^^^^^^^^^^^^^^^^^^^^^^^^
  File "/home/madduck/.local/share/pipx/venvs/pngx/lib/python3.13/site-packages/aiohttp/connector.py", line 1112, in _create_connection
    _, proto = await self._create_direct_connection(req, traces, timeout)
               ^^^^^^^^^^^^^^^^^^^^^^^^^^^^^^^^^^^^^^^^^^^^^^^^^^^^^^^^^^
  File "/home/madduck/.local/share/pipx/venvs/pngx/lib/python3.13/site-packages/aiohttp/connector.py", line 1432, in _create_direct_connection
    transp, proto = await self._wrap_create_connection(
                    ^^^^^^^^^^^^^^^^^^^^^^^^^^^^^^^^^^^
    ...<7 lines>...
    )
    ^
  File "/home/madduck/.local/share/pipx/venvs/pngx/lib/python3.13/site-packages/aiohttp/connector.py", line 1179, in _wrap_create_connection
    return await self._loop.create_connection(*args, **kwargs, sock=sock)
           ^^^^^^^^^^^^^^^^^^^^^^^^^^^^^^^^^^^^^^^^^^^^^^^^^^^^^^^^^^^^^^
  File "/usr/lib/python3.13/asyncio/base_events.py", line 1187, in create_connection
    transport, protocol = await self._create_connection_transport(
                          ^^^^^^^^^^^^^^^^^^^^^^^^^^^^^^^^^^^^^^^^
    ...<2 lines>...
        ssl_shutdown_timeout=ssl_shutdown_timeout)
        ^^^^^^^^^^^^^^^^^^^^^^^^^^^^^^^^^^^^^^^^^^
  File "/usr/lib/python3.13/asyncio/base_events.py", line 1220, in _create_connection_transport
    await waiter
asyncio.exceptions.CancelledError

The above exception was the direct cause of the following exception:

Traceback (most recent call last):
  File "/home/madduck/.local/share/pipx/venvs/pngx/lib/python3.13/site-packages/aiohttp/client.py", line 716, in _connect_and_send_request
    conn = await self._connector.connect(
           ^^^^^^^^^^^^^^^^^^^^^^^^^^^^^^
        req, traces=traces, timeout=real_timeout
        ^^^^^^^^^^^^^^^^^^^^^^^^^^^^^^^^^^^^^^^^
    )
    ^
  File "/home/madduck/.local/share/pipx/venvs/pngx/lib/python3.13/site-packages/aiohttp/connector.py", line 576, in connect
    async with ceil_timeout(timeout.connect, timeout.ceil_threshold):
               ~~~~~~~~~~~~^^^^^^^^^^^^^^^^^^^^^^^^^^^^^^^^^^^^^^^^^
  File "/usr/lib/python3.13/asyncio/timeouts.py", line 116, in __aexit__
    raise TimeoutError from exc_val
TimeoutError

The above exception was the direct cause of the following exception:

Traceback (most recent call last):
  File "/home/madduck/.bin/pngx", line 8, in <module>
    sys.exit(main())
             ~~~~^^
  File "/home/madduck/code/pngx/pngx/cli/__init__.py", line 88, in main
    return pngx()
  File "/home/madduck/.local/share/pipx/venvs/pngx/lib/python3.13/site-packages/click/core.py", line 1442, in __call__
    return self.main(*args, **kwargs)
           ~~~~~~~~~^^^^^^^^^^^^^^^^^
  File "/home/madduck/.local/share/pipx/venvs/pngx/lib/python3.13/site-packages/click/core.py", line 1363, in main
    rv = self.invoke(ctx)
  File "/home/madduck/.local/share/pipx/venvs/pngx/lib/python3.13/site-packages/click/core.py", line 1830, in invoke
    return _process_result(sub_ctx.command.invoke(sub_ctx))
                           ~~~~~~~~~~~~~~~~~~~~~~^^^^^^^^^
  File "/home/madduck/.local/share/pipx/venvs/pngx/lib/python3.13/site-packages/click/core.py", line 1830, in invoke
    return _process_result(sub_ctx.command.invoke(sub_ctx))
                           ~~~~~~~~~~~~~~~~~~~~~~^^^^^^^^^
  File "/home/madduck/.local/share/pipx/venvs/pngx/lib/python3.13/site-packages/click/core.py", line 1226, in invoke
    return ctx.invoke(self.callback, **ctx.params)
           ~~~~~~~~~~^^^^^^^^^^^^^^^^^^^^^^^^^^^^^
  File "/home/madduck/.local/share/pipx/venvs/pngx/lib/python3.13/site-packages/click/core.py", line 794, in invoke
    return callback(*args, **kwargs)
  File "/home/madduck/.local/share/pipx/venvs/pngx/lib/python3.13/site-packages/click/decorators.py", line 46, in new_func
    return f(get_current_context().obj, *args, **kwargs)
  File "/home/madduck/code/pngx/pngx/asyncio.py", line 8, in wrapper
    return asyncio.run(f(*args, **kwargs))
           ~~~~~~~~~~~^^^^^^^^^^^^^^^^^^^^
  File "/usr/lib/python3.13/asyncio/runners.py", line 195, in run
    return runner.run(main)
           ~~~~~~~~~~^^^^^^
  File "/usr/lib/python3.13/asyncio/runners.py", line 118, in run
    return self._loop.run_until_complete(task)
           ~~~~~~~~~~~~~~~~~~~~~~~~~~~~~^^^^^^
  File "/usr/lib/python3.13/asyncio/base_events.py", line 719, in run_until_complete
    return future.result()
           ~~~~~~~~~~~~~^^
  File "/home/madduck/code/pngx/pngx/cli/tags.py", line 32, in taglist
    tags = await pngx.tags()
           ^^^^^^^^^^^^^^^^^
  File "/home/madduck/code/pngx/pngx/pngx.py", line 407, in tags
    return await self._api_tags.get_all()
           ^^^^^^^^^^^^^^^^^^^^^^^^^^^^^^
  File "/home/madduck/code/pngx/pngx/wrapper.py", line 47, in get_all
    await self._load_cache()
  File "/home/madduck/code/pngx/pngx/wrapper.py", line 10, in _load_cache
    self._cache = {
                  ^
        getattr(o, self._namecol): o.id async for o in self._obj
        ^^^^^^^^^^^^^^^^^^^^^^^^^^^^^^^^^^^^^^^^^^^^^^^^^^^^^^^^
    }
    ^
  File "/home/madduck/.local/share/pipx/venvs/pngx/lib/python3.13/site-packages/pypaperless/models/mixins/helpers/iterable.py", line 30, in __aiter__
    async for page in self.pages():
        for item in page:
            yield item
  File "/home/madduck/.local/share/pipx/venvs/pngx/lib/python3.13/site-packages/pypaperless/models/generators/page.py", line 34, in __anext__
    res = await self._api.request_json("get", self._url, params=self.params)
          ^^^^^^^^^^^^^^^^^^^^^^^^^^^^^^^^^^^^^^^^^^^^^^^^^^^^^^^^^^^^^^^^^^
  File "/home/madduck/.local/share/pipx/venvs/pngx/lib/python3.13/site-packages/pypaperless/api.py", line 349, in request_json
    async with self.request(method, endpoint, **kwargs) as res:
               ~~~~~~~~~~~~^^^^^^^^^^^^^^^^^^^^^^^^^^^^
  File "/usr/lib/python3.13/contextlib.py", line 214, in __aenter__
    return await anext(self.gen)
           ^^^^^^^^^^^^^^^^^^^^^
  File "/home/madduck/.local/share/pipx/venvs/pngx/lib/python3.13/site-packages/pypaperless/api.py", line 331, in request
    res = await self._session.request(
          ^^^^^^^^^^^^^^^^^^^^^^^^^^^^
    ...<6 lines>...
    )
    ^
  File "/home/madduck/.local/share/pipx/venvs/pngx/lib/python3.13/site-packages/aiohttp/client.py", line 761, in _request
    resp = await handler(req)
           ^^^^^^^^^^^^^^^^^^
  File "/home/madduck/.local/share/pipx/venvs/pngx/lib/python3.13/site-packages/aiohttp/client.py", line 720, in _connect_and_send_request
    raise ConnectionTimeoutError(
        f"Connection timeout to host {req.url}"
    ) from exc
aiohttp.client_exceptions.ConnectionTimeoutError: Connection timeout to host https://dms.example.net/api/tags/?page=1&page_size=150
```

But if I load that exact URL into my browser on the same machine, it loads fine:

![Image](https://github.com/user-attachments/assets/82bd6114-b863-43eb-b12c-10dd39b13883)

I have checked the API auth token and generated a new one just to be sure, but the timeouts remain.

Here is what's on the wire:

```
09:33:45.874051 wifi  Out IP 192.168.205.91.43434 > 192.0.2.123.443: Flags [S], seq 3996563062, win 64240, options [mss 1460,sackOK,TS val 2749798408 ecr 0,nop,wscale 7], length 0
09:33:45.990639 wifi  In  IP 192.0.2.123.443 > 192.168.205.91.43434: Flags [S.], seq 429268469, ack 3996563063, win 65160, options [mss 1440,sackOK,TS val 1397954126 ecr 2749798408,nop,wscale 7], length 0
09:33:45.990708 wifi  Out IP 192.168.205.91.43434 > 192.0.2.123.443: Flags [.], ack 1, win 502, options [nop,nop,TS val 2749798524 ecr 1397954126], length 0
09:33:45.991845 wifi  Out IP 192.168.205.91.43434 > 192.0.2.123.443: Flags [.], seq 1:1429, ack 1, win 502, options [nop,nop,TS val 2749798525 ecr 1397954126], length 1428
09:33:45.991849 wifi  Out IP 192.168.205.91.43434 > 192.0.2.123.443: Flags [P.], seq 1429:1575, ack 1, win 502, options [nop,nop,TS val 2749798525 ecr 1397954126], length 146
09:33:46.233902 wifi  Out IP 192.168.205.91.43434 > 192.0.2.123.443: Flags [P.], seq 1429:1575, ack 1, win 502, options [nop,nop,TS val 2749798768 ecr 1397954126], length 146
09:33:46.293608 wifi  In  IP 192.0.2.123.443 > 192.168.205.91.43434: Flags [.], ack 1, win 510, options [nop,nop,TS val 1397954491 ecr 2749798524,nop,nop,sack 1 {1429:1575}], length 0
09:33:46.617925 wifi  Out IP 192.168.205.91.43434 > 192.0.2.123.443: Flags [.], seq 1:1429, ack 1, win 502, options [nop,nop,TS val 2749799152 ecr 1397954491], length 1428
09:33:47.353926 wifi  Out IP 192.168.205.91.43434 > 192.0.2.123.443: Flags [.], seq 1:1429, ack 1, win 502, options [nop,nop,TS val 2749799888 ecr 1397954491], length 1428
09:33:48.789929 wifi  Out IP 192.168.205.91.43434 > 192.0.2.123.443: Flags [.], seq 1:1429, ack 1, win 502, options [nop,nop,TS val 2749801324 ecr 1397954491], length 1428
09:33:51.829952 wifi  Out IP 192.168.205.91.43434 > 192.0.2.123.443: Flags [.], seq 1:1429, ack 1, win 502, options [nop,nop,TS val 2749804364 ecr 1397954491], length 1428
09:33:57.717941 wifi  Out IP 192.168.205.91.43434 > 192.0.2.123.443: Flags [.], seq 1:1429, ack 1, win 502, options [nop,nop,TS val 2749810252 ecr 1397954491], length 1428
09:34:09.237917 wifi  Out IP 192.168.205.91.43434 > 192.0.2.123.443: Flags [.], seq 1:1429, ack 1, win 502, options [nop,nop,TS val 2749821772 ecr 1397954491], length 1428

Here the timeout happened

09:34:33.558376 wifi  Out IP 192.168.205.91.43434 > 192.0.2.123.443: Flags [.], seq 1:1429, ack 1, win 502, options [nop,nop,TS val 2749846092 ecr 1397954491], length 1428
09:34:46.034652 wifi  In  IP 192.0.2.123.443 > 192.168.205.91.43434: Flags [F.], seq 1, ack 1, win 510, options [nop,nop,TS val 1398014235 ecr 2749798524,nop,nop,sack 1 {1429:1575}], length 0
09:34:46.034731 wifi  Out IP 192.168.205.91.43434 > 192.0.2.123.443: Flags [.], ack 2, win 502, options [nop,nop,TS val 2749858568 ecr 1398014235], length 0
09:35:20.661954 wifi  Out IP 192.168.205.91.43434 > 192.0.2.123.443: Flags [.], seq 1:1429, ack 2, win 502, options [nop,nop,TS val 2749893196 ecr 1398014235], length 1428
```

Unfortunately, I do not have access to the instance's logs, so I cannot check that side, but it seems to me that the API wrapper may be sending something Paperless NGX doesn't understand, but also doesn't reject. The tool just doesn't respond, the TCP connection actually remains open for minutes after (no FIN/RST packets to be seen…), but the client has already given up waiting.

The weird ing is: I inserted `pdb` to debug and then of course it worked. Some sort of race condition / Heisenbug?

**Comment by madduck** [comment]
It's been working again lately, after I renewed the virtualenv. I will close this and reopen when it comes back.

**Comment by tb1337** [comment]
Glad to hear it :)
